{
  "$schema": "https://json-schema.org/draft/2020-12/schema",
  "$id": "https://docs.oasis-open.org/ubl/2/json/schemas/UBL-RemittanceAdvice-2",
  "description": "A document that specifies details of an actual payment.",
  "type": "object",
  "properties": {
    "UBLEntity": {
      "const": "https://docs.oasis-open.org/ubl/2/json/schemas/UBL-RemittanceAdvice-2",
      "description": "Identifies the JSON schema governing this instance."
    },
    "UBLExtensions": {
      "$ref": "https://docs.oasis-open.org/ubl/2/json/schemas/CommonExtensionComponents-2#/$defs/UBLExtensionsType"
    },
    "UBLVersionID": {
      "$ref": "https://docs.oasis-open.org/ubl/2/json/schemas/CommonBasicComponents-2#/$defs/UBLVersionID"
    },
    "CustomizationID": {
      "$ref": "https://docs.oasis-open.org/ubl/2/json/schemas/CommonBasicComponents-2#/$defs/CustomizationID"
    },
    "ProfileID": {
      "$ref": "https://docs.oasis-open.org/ubl/2/json/schemas/CommonBasicComponents-2#/$defs/ProfileID"
    },
    "ProfileExecutionID": {
      "$ref": "https://docs.oasis-open.org/ubl/2/json/schemas/CommonBasicComponents-2#/$defs/ProfileExecutionID"
    },
    "ID": {
      "$ref": "https://docs.oasis-open.org/ubl/2/json/schemas/CommonBasicComponents-2#/$defs/ID"
    },
    "UUID": {
      "$ref": "https://docs.oasis-open.org/ubl/2/json/schemas/CommonBasicComponents-2#/$defs/UUID"
    },
    "IssueDate": {
      "$ref": "https://docs.oasis-open.org/ubl/2/json/schemas/CommonBasicComponents-2#/$defs/IssueDate"
    },
    "IssueTime": {
      "$ref": "https://docs.oasis-open.org/ubl/2/json/schemas/CommonBasicComponents-2#/$defs/IssueTime"
    },
    "Note": {
      "oneOf": [
        {
          "$ref": "https://docs.oasis-open.org/ubl/2/json/schemas/CommonBasicComponents-2#/$defs/Note"
        },
        {
          "type": "array",
          "items": {
            "$ref": "https://docs.oasis-open.org/ubl/2/json/schemas/CommonBasicComponents-2#/$defs/Note"
          },
          "minItems": 1
        }
      ]
    },
    "DocumentCurrencyCode": {
      "$ref": "https://docs.oasis-open.org/ubl/2/json/schemas/CommonBasicComponents-2#/$defs/DocumentCurrencyCode"
    },
    "TotalDebitAmount": {
      "$ref": "https://docs.oasis-open.org/ubl/2/json/schemas/CommonBasicComponents-2#/$defs/TotalDebitAmount"
    },
    "TotalCreditAmount": {
      "$ref": "https://docs.oasis-open.org/ubl/2/json/schemas/CommonBasicComponents-2#/$defs/TotalCreditAmount"
    },
    "TotalPaymentAmount": {
      "$ref": "https://docs.oasis-open.org/ubl/2/json/schemas/CommonBasicComponents-2#/$defs/TotalPaymentAmount"
    },
    "PaymentOrderReference": {
      "$ref": "https://docs.oasis-open.org/ubl/2/json/schemas/CommonBasicComponents-2#/$defs/PaymentOrderReference"
    },
    "PayerReference": {
      "$ref": "https://docs.oasis-open.org/ubl/2/json/schemas/CommonBasicComponents-2#/$defs/PayerReference"
    },
    "InvoicingPartyReference": {
      "$ref": "https://docs.oasis-open.org/ubl/2/json/schemas/CommonBasicComponents-2#/$defs/InvoicingPartyReference"
    },
    "LineCountNumeric": {
      "$ref": "https://docs.oasis-open.org/ubl/2/json/schemas/CommonBasicComponents-2#/$defs/LineCountNumeric"
    },
    "InvoicePeriod": {
      "oneOf": [
        {
          "$ref": "https://docs.oasis-open.org/ubl/2/json/schemas/CommonAggregateComponents-2#/$defs/PeriodType"
        },
        {
          "type": "array",
          "items": {
            "$ref": "https://docs.oasis-open.org/ubl/2/json/schemas/CommonAggregateComponents-2#/$defs/PeriodType"
          },
          "minItems": 1
        }
      ]
    },
    "BillingReference": {
      "$ref": "https://docs.oasis-open.org/ubl/2/json/schemas/CommonAggregateComponents-2#/$defs/BillingReferenceType"
    },
    "AdditionalDocumentReference": {
      "oneOf": [
        {
          "$ref": "https://docs.oasis-open.org/ubl/2/json/schemas/CommonAggregateComponents-2#/$defs/DocumentReferenceType"
        },
        {
          "type": "array",
          "items": {
            "$ref": "https://docs.oasis-open.org/ubl/2/json/schemas/CommonAggregateComponents-2#/$defs/DocumentReferenceType"
          },
          "minItems": 1
        }
      ]
    },
    "Signature": {
      "oneOf": [
        {
          "$ref": "https://docs.oasis-open.org/ubl/2/json/schemas/CommonAggregateComponents-2#/$defs/SignatureType"
        },
        {
          "type": "array",
          "items": {
            "$ref": "https://docs.oasis-open.org/ubl/2/json/schemas/CommonAggregateComponents-2#/$defs/SignatureType"
          },
          "minItems": 1
        }
      ]
    },
    "AccountingCustomerParty": {
      "$ref": "https://docs.oasis-open.org/ubl/2/json/schemas/CommonAggregateComponents-2#/$defs/CustomerPartyType"
    },
    "AccountingSupplierParty": {
      "$ref": "https://docs.oasis-open.org/ubl/2/json/schemas/CommonAggregateComponents-2#/$defs/SupplierPartyType"
    },
    "PayeeParty": {
      "$ref": "https://docs.oasis-open.org/ubl/2/json/schemas/CommonAggregateComponents-2#/$defs/PartyType"
    },
    "PaymentMeans": {
      "$ref": "https://docs.oasis-open.org/ubl/2/json/schemas/CommonAggregateComponents-2#/$defs/PaymentMeansType"
    },
    "TaxTotal": {
      "oneOf": [
        {
          "$ref": "https://docs.oasis-open.org/ubl/2/json/schemas/CommonAggregateComponents-2#/$defs/TaxTotalType"
        },
        {
          "type": "array",
          "items": {
            "$ref": "https://docs.oasis-open.org/ubl/2/json/schemas/CommonAggregateComponents-2#/$defs/TaxTotalType"
          },
          "minItems": 1
        }
      ]
    },
    "RemittanceAdviceLine": {
      "oneOf": [
        {
          "$ref": "https://docs.oasis-open.org/ubl/2/json/schemas/CommonAggregateComponents-2#/$defs/RemittanceAdviceLineType"
        },
        {
          "type": "array",
          "items": {
            "$ref": "https://docs.oasis-open.org/ubl/2/json/schemas/CommonAggregateComponents-2#/$defs/RemittanceAdviceLineType"
          },
          "minItems": 1
        }
      ]
    }
  },
  "required": [
    "UBLEntity",
    "ID",
    "IssueDate",
    "AccountingCustomerParty",
    "AccountingSupplierParty",
    "RemittanceAdviceLine"
  ],
  "additionalProperties": false,
  "minProperties": 1,
  "title": "Remittance Advice. Details"
}
